user,post
"RegularManlet","To be completely honest with you I get the point you are making but frankly this example is completely retarded, no one is going to care about this, this isnt really about foids not caring about sub 5's"
"braindmgedsleepycel","A few years ago I was being tutored by a family friend. She was maybe 28 and a single mother. We were remodeling the house and redoing the basement so my dad mentioned she should go see the basement. After we were done with the tutoring session I showed her the basement. It wasnt finished but she wanted to see my room so I said okIn my room, on the floor, was my AK-47 I liked to use for target shooting. I had been cleaning it the night before and just left it there in the gun cleaning bench like this.On my wall, was a canvas piece of artwork by a Ukrainian individual featuring a broken sonnenrad.She asked about it and I said it was a symbol used in various slavic/germanic cultures and tied back to ancient greece with worship of certain godsI also had a bunch of WW2 era coins, some nazi, some soviet. I also had a small piece of Wewelsburg Castle (SS headquarters) in a pendant hung by the canvas.Well, I didn't know she was a police officer in training. Oops. She reported me to the police department and reported me for having tons of nazi flags in my room and a gun out and worried I was going to do something bad.The police came to my house while I was sleeping and talked to my dad. They said they didn't care. LOLThe worst thing I might have ever done with the gun was shoot myself if I ever really thought it was over, but my dad still took it away and I haven't seen it since.I'm now over my nazilarp phase I guess but I miss my target shooting hobby"
"Linesnap99","yeah lie to that cunt and get back you gun"
"XtremeMax","I don't see the point in trying anymore. I've tried for years to make genuine friends and find a gf. There really isn't any point. I'm literally unlovable."
"Arabcel99","I don't know much about you but I have been reviewing some of your posts here (stalkmaxxing jfl)You are one of the most friendly and genuine incels out here and the fact that normies and foids don't want to do anything with you is proof that personality doesn't matter really.I wish the best fren"
"MadCel9","Well, I'm 24 years old and has never had a GF. I don't have any friends either."
"Destroyed lonely","This is one of the shittiest facts about human psych, what you think you can't have becomes your GodWhen you're constantly reminded you can't have something because of reasons outside of your control, it never makes you accept that fact, it just makes you more sensitive and all you think about is what you can't have meanwhile if you didn't know it you wouldn't even obsess over it or want it that muchER was proof of this, the reason he went ER wasn't because he wasn't good looking enough or was rejected irl, but because he was on PUAhate, which was the earliest post-redpill candidly blackpilled pessimistic forum and it fucked with his headBut the main problem isn't even blackpill and incel forums, it's foids, they just have to let you know how much they don't like you, they're rude and selfish, all social media platforms are female dominant and all they talk about is looks and how much they hate men especially ugly men, they're extremely shallow and want to force everyone to be as lookist as them, women are unironically evil"
"Destroyed lonely","There are literal chads who have had less amount of sex than some escortcels, BUT because they never feel they can't get foids they are never insecure and angry and don't constantly feel horny and lonely like incelsThe subjective value of some things is determined by how much you CAN'T HAVE them not how much you actually like them, sex & foids is one of those things, a lot of sexual attraction is based on insecurity not actual internal raw attractionThis shit gotta be a psyop, there are (((people))) who know this and use it to their advantage@CopingForBrutality@Bianor"
"Lonelyus","If women havent liked you by now, Its a sign that its over."
"DeathIsSalvation","Yeah. It's like those girls who put freckles on their face to be different but they can take them off anytime, unlike those with actual freckles."
"Clownworldcell","I’d say 7 it never began for me I should have been black pilled much earlier in life I’m thirty two and I never had a girlfriend in my twenty’s the foids at the nightclubs would ignore me the moment I would say hi to them while some of them would give chads at nightclubs their numbers and make out with chads I never should have been to nightclubs because it’s a waste of time that was never going to benefit me and would only make me jealous"
"faded","Go fuck your self you racist pieces of shit I’m fed up with white girl rejecting me I want Islam and shit skins to invade western world plz come here I will give you welfare and you can commit any crime"
"faded","Especially commit crime against white girl plz"